{
  "schema_identity": "infinium.repository.m1-slice6-successor-credential-replacement-authorization/1.0.0",
  "authority_id": "infinium.m1-s6.successor-credential-replacement-recovery/a6755587-1f60-4854-91b9-771e37a36ac9",
  "evidence_id": "infinium.m1-s6.successor-credential-replacement-evidence/836dd470-1abf-49da-b04e-6b2b2f05c04e",
  "status": "independently-reviewed-ready-for-owner-effect",
  "prepared_at_utc": "2026-08-21T21:24:29.4796114Z",
  "not_before_utc": "2026-08-21T21:26:29.4796114Z",
  "expires_at_utc": "2026-08-21T22:11:29.4796114Z",
  "owner_authority": {
    "id": "infinium.m1-s6.credential-replacement-recovery/20260821-pre-native-launcher-factory",
    "path": "docs/plans/milestones/m1/slices/s6/m1-slice6-development-campaign-amendment.v4.json",
    "sha256": "b84a5d158cce4ebb61fa1ddc7ce1dc899fbc1a5cae090fa1f26285d4786cf078"
  },
  "predecessor_ledger": {
    "path": "artifacts/m1-slice6/successor-campaign/ledger.v3.jsonl",
    "sha256": "9a1bbb048445f3eb969e16b894f8b9d8347cba5ab89c9d3c83be66e33fda5a25",
    "sequence": 39,
    "event_hash": "b5292326a65791731614a6ab75a0b838de121ea721d01d5489f4c2897f88dcc0"
  },
  "product_state": {
    "root_absolute": "C:/Users/vex/.codex/worktrees/223b/infinium/artifacts/m1-slice6/successor-product-state",
    "checkpoint_sha256": "7509d3d36d0512a7cbfdd704791cffcf625ce67e239388c47583daf8a2a5fecb"
  },
  "profile": {
    "access_profile_id": "openai-platform-dc68f2ca9775415eb6fa78de5cafe14e",
    "predecessor_generation_id": "g-ff6d82e7a7d244f6b8a9d0164991be37",
    "predecessor_target_fingerprint_sha256": "06637d7e67004768b83297623114c8e44c7298c9a2ab37c05ab41fa8617a4dd0",
    "successor_generation_id": "g-e6b6a3f21ad74108ba65955850349f83",
    "successor_generation_ordinal": 2,
    "successor_target_fingerprint_sha256": "e7be7fd8ea2adef986806215f4a431174bab96b50789e855a2a18f96254c93ca",
    "target_derivation": "Infinium:<access_profile_id>:<generation_id>",
    "target_encoding": "utf-8"
  },
  "release_build": {
    "implementation_commit": "f52629997f80853c66302ecb4f57701b304862b0",
    "coordinator_path": "src/Infinium.Coordinator/bin/Release/net10.0/Infinium.Coordinator.exe",
    "coordinator_sha256": "7a977e0e57757d4cb3fc4128e88a2c5582de0c583862974dcda090a9588502b8",
    "helper_path": "src/Infinium.CredentialHelper/bin/Release/net10.0/Infinium.CredentialHelper.exe",
    "helper_sha256": "ff9bd26fb5f89d1fbcc14b84458e8337b72b1f4eecc05e13f60050e81e504354"
  },
  "effect_boundary": {
    "evidence_path": "artifacts/m1-slice6/successor-credential-replacement-recovery/a6755587-1f60-4854-91b9-771e37a36ac9/replacement-evidence.v1.json",
    "helper_launches": 1,
    "dns_resolutions": 0,
    "network_operations": 0,
    "provider_operations": 0,
    "billable_operations": 0,
    "automatic_retry": false,
    "enumeration": "prohibited",
    "secret_exposure": "prohibited"
  },
  "native_boundary": {
    "maximum_calls": {
      "CredWriteW": 1,
      "CredReadW": 6,
      "CredDeleteW": 1,
      "CredFree": 3,
      "total": 11
    },
    "enumeration": "prohibited",
    "overwrite": "prohibited",
    "predecessor_delete": "required-after-successor-write-readback-verification"
  },
  "m1_entry_surface": {
    "purpose": "m1-native-boundary-production-enrollment-only-not-final-product-settings-ui",
    "owner": "one-shot-credential-helper",
    "presentation": "direct-helper-owned-native-modal",
    "masked": true,
    "paste_permitted": true,
    "renderer_receives_or_retains_secret": false,
    "manual_value": "owner-owned-real-openai-api-key-only-after-exact-authorization-never-test-or-dummy-value",
    "readiness_deadline_seconds": 10,
    "response_deadline_seconds": 600,
    "readiness_requirements": [
      "visible",
      "helper-process-owned",
      "same-session",
      "input-desktop",
      "not-cloaked",
      "on-monitor",
      "enabled",
      "edit-focused",
      "foreground",
      "active",
      "initially-and-currently-blank",
      "message-pump-active"
    ],
    "pre_readiness_input": "ignore-action-drain-and-clear-edit-content-before-readiness",
    "input_bound": "live-character-length-1-through-2560-and-utf8-byte-length-1-through-2560-no-truncation",
    "cleanup_requirements": [
      "set-native-edit-empty",
      "verify-native-edit-empty",
      "clear-managed-char-buffer",
      "clear-secret-bytes",
      "destroy-window-and-verify",
      "join-sta-thread",
      "terminate-contained-process-tree"
    ],
    "cancel_result": "typed-cancel-no-write-no-profile-activation-no-dispatch"
  }
}
